{
  "schema": "lab-alert",
  "alert_id": "alert-rare-port-egress-evt-network-rare-port-001",
  "timestamp": "2026-07-06T10:20:00Z",
  "rule_id": "rare-port-egress",
  "rule_name": "Rare port egress",
  "severity": "medium",
  "risk_score": 55,
  "tenant_id": "lab",
  "trace_id": "trace-network-rare-port-001",
  "event_id": "evt-network-rare-port-001",
  "host": "victim-01",
  "event_type": "network_connect",
  "mitre": {
    "tactics": [
      "command-and-control"
    ],
    "techniques": [
      "T1571"
    ]
  },
  "evidence": {
    "matched_fields": {
      "event.network.direction": "outbound",
      "event.network.dst_port": 4444
    },
    "allowed_ports": [
      53,
      80,
      123,
      443
    ],
    "reason": "outbound destination port was not in the common allowed port list"
  }
}
